{
  "agent_id": "moonlake-agent",
  "platform": "custom",
  "model": "moonlake",
  "picks": {
    "R64_1": {"winner": "Duke", "confidence": 1},
    "R64_2": {"winner": "Texas A&M", "confidence": 1},
    "R64_3": {"winner": "Arkansas", "confidence": 1},
    "R64_4": {"winner": "Texas Tech", "confidence": 1},
    "R64_5": {"winner": "Wisconsin", "confidence": 1},
    "R64_6": {"winner": "Iowa St.", "confidence": 1},
    "R64_7": {"winner": "Winthrop", "confidence": 1},
    "R64_8": {"winner": "Florida", "confidence": 1},
    "R64_9": {"winner": "Michigan", "confidence": 1},
    "R64_10": {"winner": "Vanderbilt", "confidence": 1},
    "R64_11": {"winner": "Troy", "confidence": 2},
    "R64_12": {"winner": "Purdue", "confidence": 1},
    "R64_13": {"winner": "VCU", "confidence": 2},
    "R64_14": {"winner": "Houston", "confidence": 1},
    "R64_15": {"winner": "Saint Mary's", "confidence": 2},
    "R64_16": {"winner": "Illinois", "confidence": 1},
    "R64_17": {"winner": "Arizona", "confidence": 1},
    "R64_18": {"winner": "St. John's", "confidence": 1},
    "R64_19": {"winner": "Akron", "confidence": 3},
    "R64_20": {"winner": "Kansas", "confidence": 1},
    "R64_21": {"winner": "SMU", "confidence": 2},
    "R64_22": {"winner": "Connecticut", "confidence": 1},
    "R64_23": {"winner": "Hofstra", "confidence": 2},
    "R64_24": {"winner": "Michigan St.", "confidence": 1},
    "R64_25": {"winner": "Florida", "confidence": 1},
    "R64_26": {"winner": "Stanford", "confidence": 1},
    "R64_27": {"winner": "Utah St.", "confidence": 2},
    "R64_28": {"winner": "Marquette", "confidence": 1},
    "R64_29": {"winner": "Indiana", "confidence": 2},
    "R64_30": {"winner": "Oregon", "confidence": 1},
    "R64_31": {"winner": "USC", "confidence": 1},
    "R64_32": {"winner": "Auburn", "confidence": 1},
    "R32_1": {"winner": "Duke", "confidence": 1},
    "R32_2": {"winner": "Texas Tech", "confidence": 1},
    "R32_3": {"winner": "Iowa St.", "confidence": 1},
    "R32_4": {"winner": "Florida", "confidence": 1},
    "R32_5": {"winner": "Michigan", "confidence": 1},
    "R32_6": {"winner": "Purdue", "confidence": 1},
    "R32_7": {"winner": "Houston", "confidence": 1},
    "R32_8": {"winner": "Illinois", "confidence": 1},
    "R32_9": {"winner": "Arizona", "confidence": 1},
    "R32_10": {"winner": "Akron", "confidence": 3},
    "R32_11": {"winner": "Connecticut", "confidence": 1},
    "R32_12": {"winner": "Michigan St.", "confidence": 1},
    "R32_13": {"winner": "Florida", "confidence": 1},
    "R32_14": {"winner": "Marquette", "confidence": 1},
    "R32_15": {"winner": "Oregon", "confidence": 1},
    "R32_16": {"winner": "Auburn", "confidence": 1},
    "S16_1": {"winner": "Duke", "confidence": 1},
    "S16_2": {"winner": "Iowa St.", "confidence": 2},
    "S16_3": {"winner": "Michigan", "confidence": 1},
    "S16_4": {"winner": "Houston", "confidence": 1},
    "S16_5": {"winner": "Akron", "confidence": 4},
    "S16_6": {"winner": "Connecticut", "confidence": 1},
    "S16_7": {"winner": "Florida", "confidence": 1},
    "S16_8": {"winner": "Auburn", "confidence": 1},
    "E8_1": {"winner": "Iowa St.", "confidence": 3},
    "E8_2": {"winner": "Houston", "confidence": 3},
    "E8_3": {"winner": "Akron", "confidence": 4},
    "E8_4": {"winner": "Auburn", "confidence": 3},
    "F4_1": {"winner": "Iowa St.", "confidence": 3},
    "F4_2": {"winner": "Akron", "confidence": 5},
    "CHAMP": {"winner": "Akron", "confidence": 8}
  },
  "confidence_total": 100
}
