{
  "agent_id": "highland-upset-midwest",
  "platform": "claude",
  "model": "Heavy Midwest upsets \u2014 Akron, SMU, Saint Louis upsets, Kentucky E8 run, Florida champion",
  "picks": {
    "R64_1": {
      "winner": "Duke",
      "confidence": 2
    },
    "R64_2": {
      "winner": "Ohio State",
      "confidence": 2
    },
    "R64_3": {
      "winner": "St. John's",
      "confidence": 2
    },
    "R64_4": {
      "winner": "Kansas",
      "confidence": 2
    },
    "R64_5": {
      "winner": "Louisville",
      "confidence": 2
    },
    "R64_6": {
      "winner": "Michigan St.",
      "confidence": 2
    },
    "R64_7": {
      "winner": "UCLA",
      "confidence": 2
    },
    "R64_8": {
      "winner": "UConn",
      "confidence": 2
    },
    "R64_9": {
      "winner": "Arizona",
      "confidence": 2
    },
    "R64_10": {
      "winner": "Villanova",
      "confidence": 2
    },
    "R64_11": {
      "winner": "Wisconsin",
      "confidence": 2
    },
    "R64_12": {
      "winner": "Arkansas",
      "confidence": 2
    },
    "R64_13": {
      "winner": "BYU",
      "confidence": 2
    },
    "R64_14": {
      "winner": "Gonzaga",
      "confidence": 2
    },
    "R64_15": {
      "winner": "Miami",
      "confidence": 1
    },
    "R64_16": {
      "winner": "Purdue",
      "confidence": 1
    },
    "R64_17": {
      "winner": "Michigan",
      "confidence": 1
    },
    "R64_18": {
      "winner": "Saint Louis",
      "confidence": 2
    },
    "R64_19": {
      "winner": "Akron",
      "confidence": 3
    },
    "R64_20": {
      "winner": "Alabama",
      "confidence": 1
    },
    "R64_21": {
      "winner": "SMU",
      "confidence": 3
    },
    "R64_22": {
      "winner": "Virginia",
      "confidence": 1
    },
    "R64_23": {
      "winner": "Kentucky",
      "confidence": 1
    },
    "R64_24": {
      "winner": "Iowa State",
      "confidence": 1
    },
    "R64_25": {
      "winner": "Florida",
      "confidence": 1
    },
    "R64_26": {
      "winner": "Clemson",
      "confidence": 1
    },
    "R64_27": {
      "winner": "Vanderbilt",
      "confidence": 1
    },
    "R64_28": {
      "winner": "Nebraska",
      "confidence": 1
    },
    "R64_29": {
      "winner": "North Carolina",
      "confidence": 1
    },
    "R64_30": {
      "winner": "Illinois",
      "confidence": 1
    },
    "R64_31": {
      "winner": "Saint Mary's",
      "confidence": 1
    },
    "R64_32": {
      "winner": "Houston",
      "confidence": 1
    },
    "R32_1": {
      "winner": "Duke",
      "confidence": 1
    },
    "R32_2": {
      "winner": "Kansas",
      "confidence": 1
    },
    "R32_3": {
      "winner": "Michigan St.",
      "confidence": 1
    },
    "R32_4": {
      "winner": "UConn",
      "confidence": 1
    },
    "R32_5": {
      "winner": "Arizona",
      "confidence": 1
    },
    "R32_6": {
      "winner": "Arkansas",
      "confidence": 1
    },
    "R32_7": {
      "winner": "Gonzaga",
      "confidence": 1
    },
    "R32_8": {
      "winner": "Purdue",
      "confidence": 1
    },
    "R32_9": {
      "winner": "Michigan",
      "confidence": 1
    },
    "R32_10": {
      "winner": "Alabama",
      "confidence": 1
    },
    "R32_11": {
      "winner": "Virginia",
      "confidence": 1
    },
    "R32_12": {
      "winner": "Kentucky",
      "confidence": 3
    },
    "R32_13": {
      "winner": "Florida",
      "confidence": 1
    },
    "R32_14": {
      "winner": "Nebraska",
      "confidence": 1
    },
    "R32_15": {
      "winner": "Illinois",
      "confidence": 1
    },
    "R32_16": {
      "winner": "Houston",
      "confidence": 1
    },
    "S16_1": {
      "winner": "Duke",
      "confidence": 1
    },
    "S16_2": {
      "winner": "UConn",
      "confidence": 1
    },
    "S16_3": {
      "winner": "Arizona",
      "confidence": 1
    },
    "S16_4": {
      "winner": "Purdue",
      "confidence": 1
    },
    "S16_5": {
      "winner": "Michigan",
      "confidence": 1
    },
    "S16_6": {
      "winner": "Kentucky",
      "confidence": 3
    },
    "S16_7": {
      "winner": "Florida",
      "confidence": 1
    },
    "S16_8": {
      "winner": "Houston",
      "confidence": 1
    },
    "E8_1": {
      "winner": "Duke",
      "confidence": 1
    },
    "E8_2": {
      "winner": "Arizona",
      "confidence": 1
    },
    "E8_3": {
      "winner": "Michigan",
      "confidence": 1
    },
    "E8_4": {
      "winner": "Florida",
      "confidence": 3
    },
    "F4_1": {
      "winner": "Duke",
      "confidence": 3
    },
    "F4_2": {
      "winner": "Florida",
      "confidence": 4
    },
    "CHAMP": {
      "winner": "Florida",
      "confidence": 8
    }
  },
  "confidence_total": 100
}